itemName,itemEffect,itemSource,location,act
Amulet of Restoration,"Cast Healing Word (level 1) ( Recharge: Long rest) Cast Mass Healing Word (level 3) ( Recharge: Long rest)",Private stash in the eastern room down the very first flight of stairs,The Counting House X: -85 Y: -185,3
Spell Savant Amulet,Gain one additional level 2 spell slot while having this amulet equipped,High Security Vault n°1 on the southern side of the high security vault hall,The Counting House X: -711 Y: 864,3
Jannath's Hat,"Advantage on Persuasion ability checks Advantage on Deception ability checks",High Security Vault n°2 on the southern side of the high security vault hall,The Counting House X: -714 Y: 863,3
The Long Arm of the Gur,Deal additional 1d4 Piercing damage with weapons against Undead and gain a 1d4 bonus to weapon attack rolls against Undead[16],High Security Vault n°3 on the southern side of the high security vault hall,The Counting House X: -718 Y: 861,3
Trident of the Waves,"On a hit with this trident, inflict 3 turns of Wet upon the target and spawn a 2 m / 7 ft radius water surface underneath the target",High Security Vault n°4 on the northern side of the high security vault hall,The Counting House X: -711 Y: 882,3
Ravengard's Scourger,"Gain an action to inspire an ally, giving them a condition for 3 turns to make one melee attack that deals additional 1d8 Piercing (1d10 if the ally has Improved Combat Superiority) damage and costs a Reaction[17] ( Recharge: Short rest)",High Security Vault n°5 on the northern side of the high security vault hall,The Counting House X: -712 Y: 882,3
Knock Knuckle Gloves,"Sleight of Hand +1 Cast Knock ( Recharge: Long rest)",High Security Vault n°7 on the western side of the high security vault hall,The Counting House X: -719 Y: 871,3
Elegant Studded Leather,"+2 bonus to Initiative rolls Advantage on Stealth ability checks Cast Shield ( Recharge: Short rest)",High Security Vault n°9 on the eastern-most side of the high security vault hall,The Counting House X: -686 Y: 874,3
Abdel's Trusted Shield,"Gain an action to expend your Reaction and bash with this shield when hit by an enemy, knocking them Prone for 1 turn if they fail their Dexterity save against your spell save DC Gain a concentration action to make ranged weapon attacks against you suffer disadvantage and halved Physical damage, for 10 turns ( Recharge: Short rest)",Rewarded by Golbraith Stredivas on the upper floor of Golbraith's Cellar if you convince him during dialogue of your courage against mind flayers,X: -148 Y: -60,3
Katana,Regular longsword with +1 damage,On a wooden table underneath the stuffed hyena head on the southern side of the Golbraith's Cellar basement,Golbraith's Cellar - Basement X: -2343 Y: 811,3
Unflinching Protector Amulet,"When a nearby ally is targeted by an attack of any kind, you may expend your Reaction to make that attack automatically miss ( Recharge: Long rest)",Ptaris through The Lodge portal if Steal a Githyanki Egg was completed by giving Lady Esther the Githyanki Egg,The Lodge - Basement Docks X: -1283 Y: 252,3
Staff of the Ram,"On a hit with this qarterstaff, once per turn, the target must succeed DC 8 Constitution save or get Stunned for 1 turn and be knocked back 2 m / 7 ft",Opulent chest in the room behind the secret bookcase lock in Elerrathin's Home basement shack,Elerrathin's Home - Basement X: -1572 Y: 976,3
Belm,"Gain an action to strike all nearby foes, making separate attack rolls against each target ( Recharge: Short rest) You can make an additional attack as a Bonus action with this weapon, once per turn",Opulent chest in the room behind the secret bookcase lock in Elerrathin's Home basement shack,Elerrathin's Home - Basement X: -1572 Y: 976,3
Khalid's Gift,"Jaheira cannot be Cursed while wearing this amulet Increase your Wisdom by 1 (max 21) while wearing this amulet Cast Khalid's Gift: Aid ( Recharge: Long rest)",Display case in the room behind the secret bookcase lock in Elerrathin's Home basement shack,Elerrathin's Home - Basement X: -1572 Y: 976,3
After Death Do Us Part,"When you are Downed, immediately recover and regain 50% of your hit points, but get afflicted with Shadow Possession curse ( Recharge: Long rest)","During Free the Artist, looted from Oskar Fevras at the upper floor of the Lady Jannath's Estate if Kerri Evenfield was allowed to kill him, or dropped on the floor by him if Kerri Evenfield was banished and Lady Jannath was told the truth about him",X: -250 Y: -44,3
Til Death Do Us Part,Cast Beacon of Hope ( Recharge: Long rest),"During Free the Artist, looted or stolen from Lady Jannath at the upper floor of the Lady Jannath's Estate, or dropped on the floor by her if Kerri Evenfield was banished and Lady Jannath was told the truth about Oskar Fevras",X: -250 Y: -44,3
Viconia's Walking Fortress,"Gain an action to expend your Reaction and bash with this shield when hit by an enemy, dealing 2d4 Force damage and knocking them Prone for 1 turn if they fail their Dexterity save against your spell save DC Advantage on saving throws against spells. Spell attack rolls against you suffer disadvantage Gain an action to surround yourself with a protective shell for 2 turns, reflecting any projectiles targeted at you back to their point of origin ( Recharge: Short rest) Cast Warding Bond ( Recharge: Long rest)",Viconia DeVir at the central hall of the cloister beneath the House of Grief,Cloister of Sombre Embrace X: -400 Y: -1651,3
Viconia's Priestess Robe,"While being obscured, gain advantage on Stealth ability checks While being protected by Shield of Faith, gain a +2 bonus to saving throws Armour Class +2",Viconia DeVir at the central hall of the cloister beneath the House of Grief,Cloister of Sombre Embrace X: -400 Y: -1651,3
Handmaiden's Mace,"Deal additional 1d6 Posion damage with this weapon Set your Strength to 18[9] while wielding this mace",Viconia DeVir at the central hall of the cloister beneath the House of Grief,Cloister of Sombre Embrace X: -400 Y: -1651,3
Wavemother's Cloak,"During combat, once per turn and until you take damage, gain immunity to Burning, resistance to Fire damage and vulnerability to Lightning and Cold damage",Opulent chest behind Allandra Grey's desk on the upper floor of the Water Queen's House,X: -246 Y: -249,3
Wavemother's Robe,"Resistance to Fire and Cold damage While standing on a water surface at the start of your turn during combat, regain 1d4 hit points Cast Create or Destroy Water ( Recharge: Long rest) Armour Class +1",Rewarded by Allandra Grey in the basement of Flymm Cargo for handing over Redhammer during Avenge the Drowned,Flymm Cargo - Basement X: -1048 Y: 312,3
Wavemother's Sickle,"Deal additional 1d4 Cold damage with this weapon Gain advantage on attack rolls with this weapon against Wet creatures",Allandra Grey at the Water Queen's House mourning ceremony or at her quarters on the upper floor afterwards,"X: -229 Y: -261 X: -244 Y: -251",3
Steelwatcher Helmet,"You can see in magical and ordinary darkness up to a range of 12m / 40ft. Immunity to being Blinded Advantage on Constitution saving throws",On a table on the groond floor of the Steel Watch Foundry,X: -275 Y: -134,3
Hellfire Engine Crossbow,"Cast Lightning Arrow (level 4) ( Recharge: Long rest) Gain an action to fire a harpoon at the target; The target must succeed DC 15 Dexterity save or get pulled 9 m / 30 ft towards you","Crafted by combining Watcher Crossbow Blueprint, Targeting Module, and Steel Watcher Arm on the ground floor of the Steel Watch Foundry",X: -325 Y: -134,3
Winkling Gloves,"Sleight of Hand +1 Attack rolls +1","Zanner Toobin in the west-most room on the ground floor of the Steel Watch Foundry, and later accompanying you in the foundry basement during Save the Gondians","X: -331 Y: -147 Steel Watch Foundry - Lab Level",3
Gontr Mael,"On a hit with this longbow, the target must succeed DC 15 Dexterity save or be afflicted with Guiding Bolt for 1 turn This weapon sheds light in a 6 m / 20 ft radius. This can be toggled off Cast Celestial Haste ( Recharge: Long rest) Gain an action to fire at the target, dealing additional proficiency bonus + 1d8 Radiant damage and gaining bonus 1d4 Radiant damage on subsequent attacks with this weapon, for 10 turns; The target must succeed DC 12 Wisdom save or get Frightened for 2 turns ( Recharge: Short rest)",Steel Watcher Titan in the basement of the Steel Watch Foundry,Steel Watch Foundry - Lab Level X: -1952 Y: 206,3
Drunken Cloth,"While Drunk, gain advantage on Constitution saving throws, and gain temporary hit points equal to your Constitution modifier at the start of your turn during combat",Bought or stolen from Severn at the bar in the Guildhall,Lower City Sewers X: -22 Y: 769,3
Shade-Slayer Cloak,"While Hiding, reduce the number you need to roll a critical hit while attacking by 1. This effect stacks",Bought or stolen from Sticky Dondo in the Mol encampment overseeing the pit in the Guildhall,Lower City Sewers X: -17 Y: 755,3
Cindermoth Cloak,"When you are hit in melee from up to 2 m / 7 ft away, the target must succeed DC 12 Dexterity save or get Burned for 2 turns",Aelis Siryasius in the grease elemental area to the north-west of the City Sewers waypoint,Lower City Sewers X: -123 Y: 834,3
Chancer's Carcanet,Expend your Reaction to make an attack roll or saving throw with advantage,Rewarded by Sarin in the grease elemental area to the north-west of the City Sewers waypoint for finding her skull and bringing it to her coffin,Lower City Sewers X: -125 Y: 829,3
Armour of Moonbasking,"After casting Wild Shape, gain 22 temporary hit points. While those temporary hit points are active, all incoming damage is reduced by 1 Gain a +2 bonus to AC and advantage on Constitution saving throws agains spells. This effect persist even while being in druidic Wild Shape",Bought or stolen from Voiceless Penitent Bareki in an alcove west of the Undercity Ruins waypoint,Lower City Sewers X: -157 Y: 939,3
Bonespike Helmet,"Upon entering Rage, deal 2d4 Psychic damage to all enemies in a 3 m / 10 ft radius around you; The targets must succeed DC 10 Wisdom save or receive full damage (instead of half damage on a save) Intimidation +2 Cast Menacing Attack once per turn with no Superiority Dice cost",Bought or stolen from Voiceless Penitent Bareki in an alcove west of the Undercity Ruins waypoint,Lower City Sewers X: -157 Y: 939,3
Breaching Pikestaff,Deal additional 1d4 Force damage with this weapon,On a coffin[18] in the center of the tomb that can be reached through the passage west of the Undercity Ruins waypoint in the Lower City Sewers,Ancient Lair X: -1385 Y: 60,3
Bonespike Gloves,Your weapon attacks ignore target's resistance to Physical damage,Strangler Luke[19] on top of a ruined building at the beginning of the collapsed pillar bridge during the Undercity Ruins ambush,Lower City Sewers X: -136 Y: 980,3
Crimson Mischief,"Deal additional 1d4 Necrotic damage with this weapon Deal additional 1d4 Piercing damage with this weapon against targets with 50% hit points or less While this shortsword is held in your main hand, deal additional 7 Piercing damage if the attack roll was made with advantage While this shortsword is held in your off-hand, gain Two-Weapon Fighting",Orin at the sacrificial altar of the Bhaal Temple,Lower City Sewers X: 61 Y: 1004,3
Mutilated Carapace,"While shapeshifting or disguising yourself, gain a +1 bonus to attack rolls and damage rolls Advantage on Deception and Persuasion ability checks Armour Class +1",Orin at the sacrificial altar of the Bhaal Temple,Lower City Sewers X: 61 Y: 1004,3
Bloodthirst,"Reduce the number you need to roll a critical hit while attacking by 1. This effect stacks Cast True Strike ( Recharge: Short rest) This is a Bound Weapon While this dagger is held in your main hand, creatures hit with this weapon receive vulnerability to Piercing damage, unless they are immune to it While this dagger is held in your off-hand, gain a +1 bonus to AC, and when an attack misses you, you may expend your Reaction to make a melee strike against the attacker and gain True Strike for 2 turns",Orin at the sacrificial altar of the Bhaal Temple,Lower City Sewers X: 61 Y: 1004,3
Broodmother's Revenge,"When healed, deal additional 1d6 Poison damage with weapons for 3 turns (equivalent to Dipping the weapon)",Stolen from the table of goods that belong to Koll the Red in The Watch Citadel,X: 235 Y: 44,3
Steelforged Sword,Regular shortsword with +1 damage,Stolen from the table of goods that belong to Koll the Red in The Watch Citadel,X: 235 Y: 44,3
Thermodynamo Axe,"On a hit with this battleaxe, once per attack, gain Heat for 2 turns",Stolen from the table of goods that belong to Koll the Red in The Watch Citadel,X: 235 Y: 44,3
Blade of Oppressed Souls,"Deal additional 1d4 Psychic damage with this weapon Gain an action to strike a non-undead Humanoid, dealing additional Psychic damage equal to your proficiency bonus; The target must succeed DC 12 Intelligence save or get Mad for 3 turns ( Recharge: Short rest)",Stolen from the table of goods that belong to Koll the Red in The Watch Citadel,X: 235 Y: 44,3
Devotee's Mace,"Deal additional 1d8 Radiant damage with this weapon Gain an action to emanate a soothing aura around you, regaining 1d4 hit points to you and your allies in a 9 m / 30 ft radius at the start of your turn, for 10 turns ( Recharge: Long rest)",Clerics upon reaching level 10 and choosing Arm Thy Servant as their Divine Intervention,Any,3
